{
  "$schema": "../../schemas/config-v1.schema.json",
  "schemaVersion": 1,
  "artifactDirectories": [
    "dist"
  ],
  "migrationDirectories": [
    "migrations"
  ],
  "wranglerConfig": "wrangler.jsonc",
  "phase": "predeploy",
  "maxEvidenceAgeMinutes": 60,
  "requireCleanWorktree": true,
  "healthChecks": [],
  "secretScan": {
    "exclude": []
  }
}
